11, Beautiful Apt In The Heart of Downtown Seattle, Belltown,63,4  , 1  , 2  , 1 bath,Wifi , Air conditioning , Kitchen , Elevator
12, Spacious Sophisticated Space Needle  Home, Lower Queen Anne,84,3  , 1  , 1  , 1 bath,Wifi , Kitchen , Free parking , Elevator
13, HaLongBay   Warm Spacious room near Seatac airport, Seattle,43,2  , 1  , 2  , 1 shared bath,Wifi , Free parking , Self check-in,None
14, Spacious Water View Comfy Pike Place Flat Sleeps 5, Pike Place Market,122,5  , 1  , 2  , 1 bath,Wifi , Kitchen , Pets allowed , Elevator
15, Paris  France themed room with private bathroom, Kirkland,45,1  , 1  , 1  , 1 private bath,Wifi , Kitchen , Indoor fireplace , Washer
16, Green Lake 2BR Garden Apartment   Family Friendly, Green Lake,91,4  , 2  , 3  , 1 bath,Wifi , Air conditioning , Kitchen , Free parking
17, Private cottage in Tukwila. Close to Sea Tac, Tukwila,70,2  , 1  , 1  , 1 bath,Wifi , Kitchen , Self check-in,None
18, Zermatt Switzerland themed room in Kirkland, Kirkland,38,1  , 1  , 1  , 1 shared bath,Wifi , Kitchen , Indoor fireplace , Washer
19, Live   Work   Stay   Easy   1BR in Seattle, Belltown,96,3  , 1  , 1  , 1 bath,Wifi , Air conditioning , Kitchen , Pets allowed
0, Live   Work   Stay   Easy   1BR in Mercer Island, Mercer Island, 107,3  , 1  , 1  , 1 bath,Wifi , Gym , Pets allowed , Dishwasher
1, Live   Work   Stay   Easy   Studio in Seattle, Belltown, 92,1  , Studio , 1  , 1 bath,Wifi , Gym , Air conditioning , Pets allowed
2, Private cottage in Tukwila. Close to Sea Tac, Tukwila, 70,2  , 1  , 1  , 1 bath,Wifi , Self check-in , Kitchen,None
3, Home away from home   Studio in Seattle, Lower Queen Anne, 106,1  , Studio , 1  , 1 bath,Wifi , Gym , Pets allowed , Dryer
4, Living on Vashon's Edge, Vashon, 102,2  , Studio , 1  , 1 bath,Wifi , Self check-in , Waterfront,None
5, Green Lake Master Suite Apartment with Jetted Tub, Green Lake, 96,2  , Studio , 2  , 1 bath,Wifi , Self check-in , Air conditioning , Indoor fireplace
6, Rest easy and live life   Studio in Seattle, Yesler Terrace, 106,1  , Studio , 1  , 1 bath,Wifi , Gym , Pets allowed , Dishwasher
7, 家庭旅馆单房出租, Bellevue, 35,2  , 1  , 1  , 1 shared bath,Wifi , Hot tub , Dryer , Washer
8, Females Only  Small Room in Shoreline, Shoreline, 30,1  , 1  , 1  , 1 shared bath,Wifi , Self check-in , Dishwasher , Dryer
9, Seattle Tech Amazon   Travelling nurse downtown UW, Eastlake, 73,2  , 1  , 0  , 1 bath,Wifi , Self check-in , Pets allowed , Indoor fireplace
10, A place of your own   1BR in Seattle, Yesler Terrace, 106,3  , 1  , 1  , 1 bath,Wifi , Gym , Air conditioning , Pets allowed
11, Basement  bungalow w private entrnc, Greenwood, 78,2  , 1  , 0  , 1 bath,Wifi , Self check-in , Kitchen,None
12, Entire Private Romantic Retreat  Separate Entrance, Burien, 63,6  , 1  , 3  , 1 bath,Wifi , Self check-in , Kitchen , Free parking
13, Stay as long as you want   1BR in Seattle, Pike Place Market, 129,3  , 1  , 1  , 1 bath,Wifi , Gym , Pets allowed , Dryer
14, Cool Greenlake studio loft guest house, Phinney Ridge, 61,2  , Studio , 1  , 1 private bath,Wifi , Dishwasher , Kitchen,None
15, Perry  (Freddie Mercury Room) COHस्वागत हे svaagat he, Fremont, 49,2  , 1  , 1  , 2 baths,Wifi , Self check-in , Dishwasher , Kitchen
16, Live   Work   Stay   Easy   2BR in Seattle, Belltown, 140,5  , 2  , 2  , 2 baths,Wifi , Gym , Air conditioning , Pets allowed
17, Live   Work   Stay   Easy   1BR in Seattle, Belltown, 120,3  , 1  , 1  , 1 bath,Wifi , Gym , Air conditioning , Pets allowed
18, Live   Work   Stay   Easy   1BR in Seattle, Belltown, 99,3  , 1  , 1  , 1 bath,Wifi , Gym , Air conditioning , Pets allowed
19, Everything you need   1BR in Seattle, Seattle, 141,3  , 1  , 1  , 1 bath,Wifi , Elevator , Gym , Pets allowed
0, Modern Studio in the Heart of the City Ii, Belltown,105,3  , Studio , 3  , 1 bath,Wifi , Kitchen , Free parking , Heating
1, Home away from home   1BR in Seattle, Lower Queen Anne,97,3  , 1  , 1  , 1 bath,Wifi , Kitchen,None,None
2, Beautiful Downtown Seattle Apt (Walking Score 97), Belltown,54,4  , 1  , 3  , 1 bath,Wifi , Kitchen , Heating,None
3, The Pink Room  10 min drive to downtown, Seattle,20,1  , 1  , 1  , 1 shared bath,Wifi , Kitchen , Heating,None
4, Private 1BR Apt Home in Seattle, Roosevelt,135,3  , 1  , 1  , 1 bath,Wifi , Kitchen , Heating,None
5, HaLongBay   Warm Spacious room near Seatac airport, Seattle,43,2  , 1  , 2  , 1 shared bath,Wifi , Free parking , Heating,None
6, Private Forested Hideaway Mins from all  w Hot Tub, Burien,135,4  , 1  , 2  , 1 bath,Wifi , Free parking , Heating,None
7, Rose Garden Room   2 Queen Beds for up to 4 people, Minor,20,4  , 1  , 2  , 1 shared bath,Kitchen , Heating,None,None
8, Authentic Brick Condo   Airbnb Fees Paid For!, First Hill,75,3  , 1  , 2  , 1 bath,Wifi , Kitchen , Heating,None
9, San Juan Room in Cute Brick Home (Near Airport), Burien,68,2  , 1  , 1  , 1 shared bath,Wifi , Kitchen , Free parking , Heating
10, Studio Cottage in Fauntleroy Neighborhood, Roxhill,60,2  , 1  , 1  , 1 bath,Wifi , Kitchen , Free parking , Heating
11, Live   Work   Stay   Easy   1BR in Seattle, Belltown,120,3  , 1  , 1  , 1 bath,Wifi , Kitchen,None,None
12, Live   Work   Stay   Easy   1BR in Seattle, Belltown,104,3  , 1  , 1  , 1 bath,Wifi , Kitchen,None,None
13, Live   Work   Stay   Easy   2BR in Seattle, Belltown,147,5  , 2  , 2  , 2 baths,Wifi , Kitchen , Free parking,None
14, Live   Work   Stay   Easy   1BR in Seattle, Belltown,98,3  , 1  , 1  , 1 bath,Wifi , Kitchen,None,None
15, Live   Work   Stay   Easy   Studio in Seattle, Belltown,96,1  , Studio , 1  , 1 bath,Wifi , Kitchen,None,None
16, Downtown Heart   Walk to Everything, Belltown,68,4  , Studio , 2  , 1 bath,Wifi , Kitchen , Heating,None
17, Live   Work   Stay   Easy   2BR in Mercer Island, Mercer Island,129,5  , 2  , 2  , 1 bath,Wifi , Kitchen,None,None
18, Private 1 bedroom apt in Capitol Hill  Seattle, First Hill,120,2  , 1  , 1  , 1 bath,Wifi , Kitchen , Heating,None
19, Entire Private Loft Suite  Separate Entrance, Burien,63,6  , 1  , 3  , 1 private bath,Wifi , Kitchen , Free parking , Heating
0, The Damascus Bedroom in Capitol Hill, Central Business District,25,1,1,1,1,Kitchen , Heating,None,None
1, Live   Work   Stay   Easy   1BR in Mercer Island, Mercer Island,94,3  , 1  , 1  , 1 bath,Wifi , Kitchen,None,None
2, Beautiful Ballard Cottage, Ballard,96,3  , 1  , 1  , 1 bath,Wifi , Kitchen , Free parking , Heating
3, 100% Private entrance with romantic soaking tub!, Burien,70,2  , 1  , 1  , 1 private bath,Wifi , Free parking , Heating,None
4, Paris  France themed room with private bathroom, Kirkland,45,1  , 1  , 1  , 1 private bath,Wifi , Kitchen , Heating,None
5, Elegant Condo in Heart of Seattle, South Lake Union,62,6  , 1  , 2  , 1 bath,Wifi , Kitchen , Heating,None
6, Corner Unit with Panoramic Views of Water Mountain, Queen Anne,89,4  , 1  , 2  , 1 bath,Wifi , Kitchen , Heating,None
7, Hotel like 2BR 2BA near Seattle Waterfront, Central Business District,242,5  , 2  , 2  , 2 baths,Wifi , Kitchen , Heating,None
8, Bright room in Seattle Judkins Park, Atlantic,60,2  , 1  , 1  , 1 bath,Wifi , Kitchen , Heating,None
9, Seattle Capitol Hill Studio: Broadcast Building, Capitol Hill,81,2  , Studio , 1  , 1 bath,Wifi , Kitchen , Heating,None
10, Bali Room Cozy Tropical Vibe near Seatac Airport, Seattle,39,2  , 1  , 1  , 1 shared bath,Wifi , Kitchen , Free parking , Heating
11, Brilliant apartment home   1BR in Seattle, Capitol Hill,108,3  , 1  , 1  , 1 bath,Wifi , Kitchen , Heating,None
12, The Owl Room   Shared Coed (Right Top Bed), Seattle,15,1  , 1  , 1  , 1 shared bath,Wifi , Kitchen , Heating,None
13, Downtown Historic Condo   Airbnb Fees Paid For!, First Hill,58,3  , 1  , 2  , 1 bath,Wifi , Kitchen , Heating,None
14, Professionally maintained apt   1BR in Seattle, Ballard,101,3  , 1  , 1  , 1 bath,Wifi , Kitchen,None,None
15, All inclusive apartment home   Studio in Seattle, Seattle,97,1  , Studio , 1  , 1 bath,Wifi , Kitchen,None,None
16, Live   Work   Stay   Easy   1BR in Seattle, Belltown,99,3  , 1  , 1  , 1 bath,Wifi , Kitchen,None,None
17, Live   Work   Stay   Easy   1BR in Mercer Island, Mercer Island,98,3  , 1  , 1  , 1 bath,Wifi , Kitchen,None,None
18, Live   Work   Stay   Easy   1BR in Seattle, Belltown,134,3  , 1  , 1  , 1 bath,Wifi , Kitchen,None,None
19, Live   Work   Stay   Easy   2BR in Seattle, Belltown,136,5  , 2  , 2  , 1 bath,Wifi , Kitchen , Free parking,None
0, Notting Hill England themed queen room in Kirkland, Kirkland,37,1  , 1  , 1  , 1 shared bath,Wifi , Kitchen , Heating,None
1, Stylish Apartment with Private Rooftop Deck and Sauna, Greenwood,133,3  , 1  , 1  , 1 bath,Wifi , Kitchen , Free parking , Heating
2, bellevue单房出租, Bellevue,25,2  , 1  , 1  , 1.5 shared baths,Wifi , Kitchen , Free parking , Heating
3, Luxury Farm House Aprtmnt Mins from  Airprt Seatle, Tukwila,81,8  , 3  , 5  , 1 bath,Wifi , Kitchen , Free parking , Heating
4, The Owl Private Room, Seattle,35,4  , 1  , 4  , 2 shared baths,Wifi , Kitchen , Heating,None
5, Capitol Hill Hotspot! Explore Seattle's night life, Capitol Hill,46,2  , Studio , 1  , 1.5 baths,Wifi , Heating,None,None
6, Private girly water view room in downtown Seattle, Seattle,50,2  , 1  , 1  , 1 shared bath,Wifi , Kitchen , Heating,None
7, Rest easy and live life   2BR in Seattle, Yesler Terrace,147,5  , 2  , 2  , 2 baths,Wifi , Kitchen,None,None
8, Red Door Flat  Luxurious Studio in West Seattle, Alki,139,2  , Studio , 1  , 1 bath,Wifi , Kitchen , Free parking , Heating
9, Well Appointed 1 bdrm  Penthouse  Apt   Large Deck, The Junction,91,4  , 1  , 2  , 1 bath,Wifi , Kitchen , Free parking , Heating
10, Apartment living at its finest   2BR in Seattle, Minor,140,5  , 2  , 2  , 2 baths,Wifi , Kitchen,None,None
11, Stay in a place of your own   1BR in Seattle, South Lake Union,150,3  , 1  , 1  , 1 bath,Wifi , Kitchen,None,None
12, Lovely Bedroom in West Seattle, Highland Park,35,2  , 1  , 1  , 1.5 shared baths,Wifi , Kitchen , Free parking , Heating
13, Dahl House in Columbia City, Columbia City,73,4  , 1  , 1  , 1 bath,Wifi , Free parking , Heating,None
14, The Owl Room Shared Coed (Left Bottom Bed), Seattle,15,1  , 1  , 1  , 1 shared bath,Wifi , Kitchen , Heating,None
15, ► Modern Tiny House ◄ Big Personality  AC & Views!, Tukwila,79,4  , 1  , 1  , 1 bath,Wifi , Kitchen , Free parking , Heating
16, Live   Work   Stay   Easy   1BR in Seattle, Belltown,96,3  , 1  , 1  , 1 bath,Wifi , Kitchen,None,None
17, Modern Executive Suite Near Pike and Waterfront, Central Business District,131,5  , Studio , 3  , 1 bath,Wifi , Kitchen , Heating,None
18, Live   Work   Stay   Easy   2BR in Seattle, Belltown,146,5  , 2  , 2  , 2 baths,Wifi , Kitchen,None,None
19, The Owl Room Shared Coed (Left Top Bed), Seattle,15,1  , 1  , 1  , 1 shared bath,Wifi , Kitchen , Heating,None
