,0,1,2,3,4,5,6,7,8,9,10
0,title,location,price,guests,bedrooms,beds,bathrooms,amenity_1,amenity_2,amenity_3,amenity_4
0, Capitol Hill Excursion Part four, Capitol Hill,23,1  , 1  , 1  , 1 shared bath,Wifi , Self check-in , Dryer , Washer
1, Urban Studio by International District, Minor,41,2  , Studio , 1  , 1 bath,Wifi , Gym , Air conditioning , Pets allowed
2, Live   Work   Stay   Easy   2BR in Seattle, Belltown,141,5  , 2  , 2  , 2 baths,Wifi , Air conditioning , Dryer , Washer
3, Beautiful  2 Bedroom Apt @Downtown, First Hill,65,6  , 2  , 4  , 1 bath,Wifi , Gym , Pets allowed , Dishwasher
4, A place of your own   1BR in Seattle, Yesler Terrace,106,3  , 1  , 1  , 1 bath,Wifi , Self check-in , Air conditioning , Dishwasher
5, New!  New bed and tv! Enjoy Quiet and Clean Home!, Riverview,28,1  , 1  , 0  , 1 shared bath,Wifi , Dryer , Washer , Kitchen
6, The Wonder House, Brighton,45,2  , Studio , 6  , 1 bath,Wifi , Gym , Air conditioning , Dryer
7, Corner Unit in the heart of Capitol Hill, Capitol Hill,90,1,1,1,1,Wifi , Breakfast , Pets allowed , Dryer
8, Brand New  Fully restored 1922 Craftsman   Seattle, University District,99,6  , 2  , 3  , 1 bath,Wifi , Self check-in , Kitchen , Free parking
9, Charming Maple Leaf Garden Level Apartment, Maple Leaf,60,2  , 1  , 1  , 1 bath,Wifi , Self check-in , Kitchen,None
10, Blue Nautical Room  10 min drive to downtown, Seattle,20,2  , 1  , 1  , 1 shared bath,Wifi , Self check-in , Dryer , Washer
11, Vintage Cap Hill Hideaway, Capitol Hill,98,2  , Studio , 1  , 1 bath,Wifi , Pets allowed , Dryer , Washer
12, Classic Cape Cod in a Peaceful Neighborhood, South Delridge,85,4  , 2  , 2  , 1 bath,Wifi , Self check-in , Dishwasher , Kitchen
13, Private Bungalow near Airport, Burien,64,3  , Studio , 1  , 1 private bath,Wifi , Air conditioning , Pets allowed , Kitchen
14, Urban Wildlife studio apt.  Ravenna close to U.W., Ravenna,69,2  , 1  , 1  , 1 bath,Wifi , Elevator , Self check-in , Air conditioning
15, Funky Spacious Studio in Lively Artist Enclave!!!, Belltown,82,2  , Studio , 1  , 1 bath,Wifi , Self check-in , Air conditioning , Kitchen
16, Relaxed Garden Cottage Close to Light Rail, North Beacon Hill,80,2  , 1  , 1  , 1 bath,Wifi , Self check-in , Dryer , Washer
17, Capitol Hill Excursion Bed Nook w Privacy curtain, Capitol Hill,20,1  , 1  , 1  , 1 shared bath,Wifi , Self check-in , Dryer , Washer
18, Capitol Hill Excursion, Capitol Hill,26,1  , 1  , 1  , 1 shared bath,Wifi , Gym , Air conditioning , Pets allowed
0, Lovely Historical Apartment  With Great Views!!!, Belltown,91,2  , Studio , 1  , 1 bath,Wifi , Elevator , Self check-in , Air conditioning
1, Urban Studio by International District, Minor,41,2  , Studio , 1  , 1 bath,Wifi , Self check-in , Air conditioning , Pets allowed
2, Sunny Tiny House  Deck  Garden & Parking, Magnolia,62,2  , Studio , 1  , 1 bath,Wifi , Elevator , Air conditioning , Dishwasher
3, Downtown Oasis (Parking Included) WS 98, Central Business District,69,4  , 1  , 2  , 1 bath,Wifi , Breakfast , Self check-in , Air conditioning
4, Westlake home with breakfast & walk to waterfront, Westlake,64,2  , 1  , 1  , 1 private bath,Wifi , Self check-in , Dryer , Washer
5, Sunset Hill  Ballard  North Seattle, Ballard,54,4  , 2  , 2  , 1 bath,Wifi , Elevator , Self check-in , Gym
6, Charming City Quarters with Balcony Views, Pike Place Market,101,4  , 1  , 2  , 1 bath,Wifi , Self check-in , Kitchen , Free parking
7, Charming Maple Leaf Garden Level Apartment, Maple Leaf,60,2  , 1  , 1  , 1 bath,Wifi , Self check-in , Dryer , Washer
8, Charming  Private 2 Bed Montlake Suite w  Parking, Capitol Hill,57,4  , 2  , 2  , 1 bath,Wifi , Self check-in , Kitchen , Free parking
9, Private Paris Room: Near Airport & Seattle (#1), Burien,40,2  , 1  , 1  , 1 shared bath,Wifi , Self check-in,None,None
10, Detached Wallingford Studio Apartment, Fremont,55,2  , 1  , 1  , 1 bath,Wifi , Self check-in,None,None
11, Private Room & Entrance in Central Seattle Home, Madrona,55,2  , 1  , 1  , 1 private bath,Wifi , Self check-in , Indoor fireplace , Dryer
12, Studio on the Blvd Airport Light Rail Hot Spot, Tukwila,57,3  , Studio , 2  , 1 bath,Wifi , Self check-in , Air conditioning,None
13, Tiny House Backyard Bungalow Next to Green Lake, Green Lake,81,2  , Studio , 2  , 1 bath,Wifi , Self check-in , Dishwasher , Kitchen
14, Central district charmer with parking spot., Minor,83,2  , Studio , 0  , 1 bath,Wifi , Self check-in , Dryer , Washer
15, The Broadway Apartment Near Downtown Capital Hill, Yesler Terrace,47,4  , Studio , 2  , 1 bath,Wifi , Self check-in , Free parking,None
16, Private Studio Apartment in West Seattle, The Junction,61,2  , 1  , 1  , 1 bath,Wifi , Breakfast , Self check-in , Dryer
17, West Seattle Oasis, North Admiral,55,2  , 1  , 1  , 1 bath,Wifi , Self check-in , Air conditioning , Dishwasher
18, Hip Flat. Iconic Downtown. Walk to Pike Place Mkt, Belltown,71,2  , Studio , 1  , 1 bath,Wifi , Elevator , Self check-in , Pets allowed
0, Heart of Capitol Hill Studio 9, Capitol Hill,49,2  , Studio , 1  , 1 bath,Wifi , Self check-in , Dryer , Washer
1, Waterfront & Pikes Place Heart in Downtown Seattle, Central Business District,80,2  , 1  , 0  , 1 bath,Wifi , Pool , Gym , Waterfront
2, Cute Studio and Breakfast with Yard and Nearby Bus, Magnolia,50,2  , Studio , 1  , 1 bath,Wifi , Breakfast , Self check-in , Dishwasher
3, Fully Furnished Studio Apartment, Capitol Hill,80,2  , Studio , 1  , 1 bath,Wifi , Self check-in , Dryer , Washer
4, Panoramic Days in the Heart of Downtown Seattle, Central Business District,85,2  , 1  , 1  , 1 private bath,Wifi , Elevator , Self check-in , Waterfront
5, Downtown Condo. 2BR 2BA. 3 Month Min., Belltown,140,4  , 2  , 2  , 2 baths,Wifi , Elevator , Gym , Air conditioning
6, The Serendipity Room in the CD, Minor,20,1,1,1,1,Wifi , Self check-in , Dryer , Washer
7, Cornflower Blue Bedroom 10mins walk to Downtown, Central Business District,25,1,1,1,1,Wifi , Self check-in , Air conditioning , Dryer
8, Charming  Private 2 Bed Montlake Suite w  Parking, Capitol Hill,57,4  , 2  , 2  , 1 bath,Wifi , Pets allowed , Dryer , Washer
9, Cozy Private Space North Seattle Private Parking, Victory Heights,52,3  , 2  , 3  , 2.5 baths,Wifi , Self check-in , Free parking,None
10, Classic Cape Cod in a Peaceful Neighborhood, South Delridge,85,4  , 2  , 2  , 1 bath,Wifi , Self check-in , Pets allowed , Free parking
11, Greenwood Piano Studio   Clean lines & big windows, Greenwood,33,2  , Studio , 1  , 1 bath,Wifi , Pets allowed , Dishwasher , Dryer
12, North Burien Nest, Seattle,34,2  , 1  , 1  , 1 private bath,Wifi , Gym , Air conditioning , Pets allowed
13, Everything you need   2BR in Shoreline, Shoreline,128,5  , 2  , 2  , 1 bath,Wifi , Gym , Pets allowed , Dryer
14, Live   Work   Stay   Easy   1BR in Seattle, Belltown,93,3  , 1  , 1  , 1 bath,Wifi , Elevator , Pool , Gym
15, Live   Work   Stay   Easy   2BR in Seattle, Belltown,141,5  , 2  , 2  , 2 baths,Wifi , Self check-in , Kitchen,None
16, Upscale 1BR w  rooftop terrace in Seattle, Central Business District,172,3  , 1  , 1  , 1 bath,Wifi , Gym , Air conditioning , Pets allowed
17, Elegant Tangerine Room  10 min drive to downtown, Seattle,20,2  , 1  , 1  , 1 shared bath,Wifi , Hot tub , Dryer , Washer
0, Panoramic Days in the Heart of Downtown Seattle, Central Business District,85,2  , 1  , 1  , 1 private bath,Wifi , Kitchen , Elevator , Washer
1, High End 1BR w  great amenities in Seattle, Roosevelt,140,3  , 1  , 1  , 1 bath,Wifi , Air conditioning , Kitchen , Pets allowed
2, Waterfront & Pikes Place Heart in Downtown Seattle, Central Business District,80,2  , 1  , 0  , 1 bath,Wifi , Pool , Kitchen , Pets allowed
3, Modern apartment with Space Needle view, Queen Anne,80,2  , 1  , 1  , 1 bath,Wifi , Kitchen , Self check-in , Dishwasher
4, Cute Studio and Breakfast with Yard and Nearby Bus, Magnolia,50,2  , Studio , 1  , 1 bath,Wifi , Kitchen , Breakfast , Self check-in
5, Waterfront Ballard Cottage, Ballard,200,2  , 1  , 1  , 1 bath,Wifi , Kitchen , Free parking , Pets allowed
6, Modern Townhouse N. Beacon Hill  Near CenturyLink, North Beacon Hill,48,2  , 1  , 1  , 1 bath,Wifi , Self check-in,None,None
7, Lux 1BD with floor to ceiling tile in bathroom and kitchen, Pike Place Market,99,2  , 1  , 1  , 1 bath,Wifi , Kitchen , Elevator , Washer
8, Charming  Private 2 Bed Montlake Suite w  Parking, Capitol Hill,57,4  , 2  , 2  , 1 bath,Wifi , Free parking , Washer , Dryer
9, Incredible apartment home   1BR in Seattle, Lower Queen Anne,95,3  , 1  , 1  , 1 bath,Wifi , Kitchen , Pets allowed , Gym
10, Spacious   Sunny apartment near Lake Union, South Lake Union,85,3  , 1  , 1  , 1.5 baths,Wifi , Air conditioning , Kitchen , Washer
11, Wealth&Peace   Cozy 4, Seattle,40,1  , 1  , 1  , 1 shared bath,Wifi , Kitchen , Washer , Dryer
12, Tiny House in Seattle, Genesee,112,3  , 1  , 1  , 1 bath,Wifi , Air conditioning , Kitchen , Free parking
13, 华盛顿湖景别墅单房出租, Seward Park,30,2  , 1  , 1  , 1.5 baths,Wifi , Pool , Kitchen , Free parking
14, Live   Work   Stay   Easy   2BR in Seattle, Belltown,140,5  , 2  , 2  , 2 baths,Wifi , Air conditioning , Kitchen , Pets allowed
15, Live   Work   Stay   Easy   Studio in Seattle, Belltown,92,1  , Studio , 1  , 1 bath,Wifi , Kitchen , Pets allowed , Gym
16, 1BR with 24 hour gym in Seattle, Central Business District,141,3  , 1  , 1  , 1 bath,Wifi , Air conditioning , Pool , Kitchen
17, Apartment in The Heart of Seattle, Lower Queen Anne,105,2  , 1  , 1  , 1 bath,Wifi , Air conditioning , Kitchen , Free parking
18, North Burien Nest, Seattle,34,2  , 1  , 1  , 1 private bath,Wifi , Free parking , Pets allowed , Self check-in
19, Capitol Hill one Bedroom 10, Capitol Hill,57,4  , 1  , 1  , 1 bath,Wifi , Kitchen , Free parking , Washer
0, Private Bungalow near Airport, Burien,64,3  , Studio , 1  , 1 private bath,Wifi , Kitchen , Free parking , Self check-in
1, The Yellow Room (Private) in Fairwood, Renton,37,2  , 1  , 1  , 2 shared baths,Wifi , Kitchen , Free parking , Indoor fireplace
2, Large studio apt near Capitol Hill & Seattle U, Minor,41,2  , Studio , 1  , 1 bath,Wifi , Kitchen , Washer , Dryer
3, West Seattle Beach House, Alki,160,4  , 1  , 2  , 1 bath,Wifi , Air conditioning , Kitchen , Free parking
4, Rest easy and live life   Studio in Seattle, Yesler Terrace,93,1  , Studio , 0  , 1 bath,Wifi , Kitchen , Pets allowed , Gym
5, Charming lower level suite in Shoreline!, Shoreline,70,4  , 2  , 2  , 1 bath,Wifi , Free parking , Pets allowed , Breakfast
6, Charming Market Apartment with Bright City Views, Pike Place Market,74,3  , 1  , 1  , 1 bath,Wifi , Kitchen , Pets allowed , Elevator
7, Cozy Private Space North Seattle Private Parking, Victory Heights,52,3  , 2  , 3  , 2.5 baths,Wifi , Air conditioning , Free parking , Washer
8, Live   Work   Stay   Easy   1BR in Seattle, Belltown,93,3  , 1  , 1  , 1 bath,Wifi , Air conditioning , Kitchen , Free parking
9, A place of your own   1BR in Seattle, Yesler Terrace,108,3  , 1  , 1  , 1 bath,Wifi , Kitchen , Pets allowed , Gym
10, Home away from home   1BR in Seattle, Lower Queen Anne,97,3  , 1  , 1  , 1 bath,Wifi , Kitchen , Pets allowed , Gym
11, Everything you need   1BR in Seattle, Central Business District,169,3  , 1  , 1  , 1 bath,Wifi , Pool , Kitchen , Pets allowed
12, Private Paris Room: Near Airport & Seattle (#1), Burien,40,2  , 1  , 1  , 1 shared bath,Wifi , Kitchen , Free parking , Self check-in
13, 湖景别墅单房(2）出租, Seward Park,25,2  , 1  , 1  , 2 shared baths,Wifi , Kitchen , Free parking , Washer
14, 2BR Green Lake View Penthouse & Rooftop Deck, Green Lake,100,4  , 2  , 3  , 1 bath,Wifi , Air conditioning , Kitchen , Free parking
15, Funky Spacious Studio in Lively Artist Enclave!!!, Belltown,82,2  , Studio , 1  , 1 bath,Wifi , Air conditioning , Kitchen , Elevator
16, Hummingbird Hideaway, Shoreline,39,4  , 1  , 2  , 1 bath,Wifi , Air conditioning , Kitchen , Free parking
17, Beautiful  tranquil apartment in prime location, Capitol Hill,57,2  , 1  , 1  , 1 bath,Wifi , Kitchen , Washer , Dryer
18, Cozy house in great neighborhood in Seattle, Ballard,42,2  , 1  , 1  , 1 shared bath,Wifi , Kitchen , Free parking , Indoor fireplace
19, North Burien Nest, Seattle,34,2  , 1  , 1  , 1 private bath,Wifi , Free parking , Pets allowed , Self check-in
0, Elegant Tangerine Room  10 min drive to downtown, Seattle,20,2  , 1  , 1  , 1 shared bath,Wifi , Self check-in , Kitchen,None
1, Stunning Queen Anne Bungalow Close to everything!, Queen Anne,98,6  , 2  , 2  , 1 bath,Wifi , Self check-in , Indoor fireplace , Dishwasher
2, Waterfront Ballard Cottage, Ballard,200,2  , 1  , 1  , 1 bath,Wifi , Self check-in , Beachfront , Pets allowed
3, Tiny House in Seattle, Genesee,112,3  , 1  , 1  , 1 bath,Wifi , Self check-in , Air conditioning , Indoor fireplace
4, Bright room in Seattle Judkins Park, Atlantic,60,2  , 1  , 1  , 1 bath,Wifi , Breakfast , Indoor fireplace , Dryer
5, Private beach cabin  Vashon Island, Vashon,99,2  , Studio , 0  , 1 bath,Wifi , Self check-in , Beachfront , Indoor fireplace
6, Live   Work   Stay   Easy   1BR in Seattle, Belltown,99,3  , 1  , 1  , 1 bath,Wifi , Gym , Air conditioning , Pets allowed
7, Live   Work   Stay   Easy   Studio in Seattle, Belltown,97,1  , Studio , 1  , 1 bath,Wifi , Gym , Air conditioning , Pets allowed
8, All inclusive apartment home   Studio in Seattle, Seattle,90,1  , Studio , 1  , 1 bath,Wifi , Gym , Pets allowed , Dryer
9, Rest easy and live life   Studio in Seattle, Yesler Terrace,93,1  , Studio , 0  , 1 bath,Wifi , Gym , Pets allowed , Dishwasher
10, Stunning Capitol Hill View Apartment, Capitol Hill,83,2  , Studio , 1  , 1 bath,Wifi , Air conditioning , Dryer , Washer
11, 1BR with 24 hour gym in Seattle, Central Business District,141,3  , 1  , 1  , 1 bath,Wifi , Elevator , Pool , Gym
12, Private modern loft on south Capitol Hill, Atlantic,89,3  , 1  , 2  , 1 bath,Wifi , Elevator , Breakfast , Gym
13, Colorful Queen Anne 2BR with a view  Vista Room B, Lower Queen Anne,45,2  , 1  , 1  , 1 shared bath,Wifi , Kitchen,None,None
14, Private Apartment in the Heart of the City, Greenwood,79,4  , 1  , 2  , 1 bath,Wifi , Self check-in , Dishwasher , Kitchen
15, Apartment living at its finest   1BR in Seattle, Minor,112,3  , 1  , 1  , 1 bath,Wifi , Elevator , Gym , Pets allowed
16, Lovely Bedroom in West Seattle, Highland Park,35,2  , 1  , 1  , 1.5 shared baths,Wifi , Breakfast , Self check-in , Air conditioning
17, Pacific NW Room in ideal Wallingford neighborhood, Wallingford,55,2  , 1  , 1  , 1 shared bath,Wifi , Breakfast , Self check-in , Air conditioning
18, Smiljan (Tesla) Croatia themed room in Kirkland, Kirkland,39,1  , 1  , 1  , 1 shared bath,Wifi , Indoor fireplace , Dishwasher , Dryer
19, Sunny Tiny House  Deck  Garden & Parking, Magnolia,62,2  , Studio , 1  , 1 bath,Wifi , Self check-in , Air conditioning , Pets allowed
0, Quiet  Cottage  Apartment near Seattle and Renton, Seattle,54,2  , 1  , 1  , 1 bath,Wifi , Kitchen , Free parking,None
1, The Yellow Room (Private) in Fairwood, Renton,37,2  , 1  , 1  , 2 shared baths,Wifi , Kitchen , Free parking , Indoor fireplace
2, 2BR 2BA resort style building in Seattle, Roosevelt,176,5  , 2  , 2  , 2 baths,Wifi , Air conditioning , Kitchen , Pets allowed
3, Wonderful Home in the Heart of Ballard!, Ballard,51,4  , 1  , 2  , 1 bath,Wifi , Kitchen , Pets allowed , Indoor fireplace
4, 房屋分租, North Beacon Hill,25,2  , 1  , 1  , 1 private bath,Wifi , Kitchen , Free parking , Hot tub
5, West Seattle Oasis, North Admiral,55,2  , 1  , 1  , 1 bath,Wifi , Kitchen , Breakfast , Washer
6, Luxurious Apt by WA Convention Center  DT & Mall, First Hill,86,6  , 1  , 2  , 1 bath,Wifi , Kitchen , Pets allowed , Gym
7, A home away from home, SeaTac,78,4  , 2  , 3  , 1.5 baths,Wifi , Kitchen , Free parking , Pets allowed
8, Sweet Room in Mindfulness Studio w  Hot Tub Option, Wallingford,26,2  , 1  , 1  , 1 shared bath,Wifi , Air conditioning , Free parking , Hot tub
9, Live   Work   Stay   Easy   1BR in Seattle, Belltown,118,3  , 1  , 1  , 1 bath,Wifi , Air conditioning , Kitchen , Free parking
10, Live   Work   Stay   Easy   Studio in Seattle, Belltown,96,1  , Studio , 1  , 1 bath,Wifi , Kitchen , Pets allowed , Gym
11, Home away from home   1BR in Seattle, Lower Queen Anne,105,3  , 1  , 1  , 1 bath,Wifi , Kitchen , Pets allowed , Gym
12, San Francisco Sunset twin 10 min drive to downtown, Seattle,20,1  , 1  , 1  , 1 shared bath,Wifi , Kitchen , Self check-in,None
13, The Serendipity Room in the CD, Minor,20,1,1,1,1,Wifi , Air conditioning , Kitchen , Gym
14, [AC included] HIGH RISE 1BEDROOM with AMAZING view, First Hill,107,4  , 1  , 1  , 1 bath,Wifi , Kitchen , Pets allowed , Gym
15, All inclusive apartment home   1BR in Seattle, Seattle,101,3  , 1  , 1  , 1 bath,Wifi , Free parking , Self check-in,None
16, Lakeview Hideaway, Lake Forest Park,50,2  , 1  , 1  , 1 private bath,Wifi , Air conditioning , Kitchen , Free parking
17, Green Lake Master Suite Apartment with Jetted Tub, Green Lake,96,2  , Studio , 2  , 1 bath,Wifi , Kitchen , Pets allowed , Washer
18, Brilliant apartment home   1BR in Seattle, Capitol Hill,130,3  , 1  , 1  , 1 bath,Wifi , Kitchen , Pets allowed , Elevator
0, Seattle Tech Amazon   Travelling nurse downtown UW, Eastlake,73,2  , 1  , 0  , 1 bath,Wifi , Kitchen , Heating,None
1, ⭐️ The Maple Leaf Mother in Law (near UW Greenlake), Maple Leaf,40,2  , 1  , 2  , 1 bath,Wifi , Kitchen , Free parking , Heating
2, Central district charmer with parking spot., Minor,83,2  , Studio , 0  , 1 bath,Wifi , Kitchen , Free parking , Heating
3, Backyard studio at Pritchard Beach, Dunlap,61,2  , Studio , 1  , 1 bath,Wifi , Free parking , Heating,None
4, Large studio apt near Capitol Hill & Seattle U, Minor,41,2  , Studio , 1  , 1 bath,Wifi , Kitchen , Heating,None
5, City Garden Retreat in Vibrant Walkable Neighborhood, Wallingford,79,3  , Studio , 2  , 1 bath,Wifi , Kitchen , Heating,None
6, Cool Greenlake studio loft guest house, Phinney Ridge,61,2  , Studio , 1  , 1 private bath,Wifi , Kitchen , Heating,None
7, Lakeview Hideaway, Lake Forest Park,50,2  , 1  , 1  , 1 private bath,Wifi , Free parking , Heating,None
8, Live   Work   Stay   Easy   1BR in Seattle, Belltown,98,3  , 1  , 1  , 1 bath,Wifi , Kitchen,None,None
9, Live   Work   Stay   Easy   Studio in Seattle, Belltown,97,1  , Studio , 1  , 1 bath,Wifi , Kitchen,None,None
10, All inclusive apartment home   Studio in Seattle, Seattle,90,1  , Studio , 1  , 1 bath,Wifi , Kitchen,None,None
11, Bohemian Oasis, Fremont,75,2  , 1  , 1  , 1 bath,Kitchen , Free parking , Heating,None
12, Homey Urban Pad Like A Friend's Place Sleeps 4, Pike Place Market,89,4  , 1  , 2  , 1 bath,Wifi , Kitchen , Heating,None
13, The Yellow Room  10 min drive to downtown, University District,20,1  , 1  , 1  , 1 shared bath,Wifi , Heating,None,None
14, Birdhouse on Green Lake, Green Lake,84,5  , 1  , 1  , 1 bath,Wifi , Kitchen , Heating,None
15, 2BR Greenwood Artists Hideaway, Greenwood,73,3  , 2  , 2  , 1 bath,Wifi , Kitchen , Heating,None
16, Everything you need   1BR in Seattle, Central Business District,169,3  , 1  , 1  , 1 bath,Wifi , Kitchen,None,None
17, Charming & Bright Downtown Studio, Belltown,48,4  , Studio , 2  , 1 bath,Wifi , Kitchen , Heating,None
18, Retro meets Modern Walkable & Mins to Attractions, Queen Anne,89,4  , 1  , 2  , 1 bath,Wifi , Kitchen , Heating,None
19, Private Cottage, Minor,79,2  , 1  , 1  , 1 bath,Wifi , Kitchen , Free parking , Heating
0, Self Isolate in Capitol Hill Loft w Rooftop Access, Capitol Hill,85,4  , Studio , 2  , 1 bath,Wifi , Kitchen , Washer , Dryer
1, Old charm top floor studio apartment, Minor,69,3  , 1  , 1  , 1 bath,Wifi , Kitchen , Free parking , Self check-in
2, Downtown Heart   Walk to Everything, Belltown,68,4  , Studio , 2  , 1 bath,Wifi , Air conditioning , Kitchen , Gym
3, Private Ballard Backyard Cottage with Natural Light, Ballard,92,2  , Studio , 1  , 1 bath,Wifi , Kitchen , Self check-in,None
4, Charming lower level suite in Shoreline!, Shoreline,70,4  , 2  , 2  , 1 bath,Wifi , Free parking , Pets allowed , Breakfast
5, New Garden Studio in Madison Valley, Harrison/Denny-Blaine,81,2  , 1  , 1  , 1 bath,Wifi , Kitchen , Free parking , Washer
6, Genesse Hills Daylight Basement Suite, Alki,56,2  , 1  , 1  , 1 bath,Wifi , Free parking , Washer , Dryer
7, Gorgeous Seattle Suite w  Luxurious Soaking Tub!, Green Lake,70,2  , 1  , 1  , 1 bath,Wifi , Air conditioning , Kitchen , Free parking
8, Cozy Sanctuary of Color and Art, Rainier View,49,2  , 1  , 1  , 1 bath,Wifi , Free parking , Gym , Washer
9, Historic loft in Pioneer Square, Pioneer Square,142,4  , 1  , 3  , 1 bath,Wifi , Kitchen , Washer , Dryer
10, New One Bedroom with Balcony  Walk to Space Needle, Lower Queen Anne,85,3  , 1  , 1  , 1 bath,Wifi , Air conditioning , Kitchen , Free parking
11, Urban Oasis in Capitol Hill, Capitol Hill,75,3  , Studio , 1  , 1 bath,Wifi , Kitchen , Washer , Dryer
12, Beautiful Guest Suite for 2 in Ballard, Ballard,51,2  , 1  , 1  , 1 private bath,Wifi , Air conditioning,None,None
13, Beautiful Apt In The Heart of Downtown Seattle, Belltown,63,4  , 1  , 2  , 1 bath,Wifi , Air conditioning , Kitchen , Elevator
14, Historic Merchant's Apartment 303 B, Pioneer Square,64,2  , 1  , 1  , 1 bath,Wifi , Air conditioning , Kitchen , Breakfast
15, Cozy Urban Chic Capitol Hill Home, Capitol Hill,61,2  , 1  , 1  , 1 bath,Wifi , Self check-in,None,None
16, Delightful Lake Forest Park Studio, Lake Forest Park,63,3  , 1  , 1  , 1 bath,Wifi , Free parking , Self check-in,None
17, Beautiful Ballard Cottage, Ballard,96,3  , 1  , 1  , 1 bath,Wifi , Kitchen , Free parking , Self check-in
18, Beautiful  2 Bedroom Apt @Downtown, First Hill,65,6  , 2  , 4  , 1 bath,Wifi , Air conditioning , Washer , Dryer
19, Guest Suite Around the Corner from Alki Beach!, North Delridge,35,2  , 1  , 1  , 1 bath,Wifi , Self check-in,None,None
0, Emerald House Fremont w  parking  no cleaning fee, Fremont,122,5  , 2  , 2  , 1 bath,Wifi , Self check-in , Air conditioning , Dishwasher
1, Professionally maintained apt   2BR in Seattle, Ballard,138,5  , 2  , 2  , 1 bath,Wifi , Pool , Gym , Pets allowed
2, Homey place just for you   1BR in Seattle, South Lake Union,204,3  , 1  , 1  , 1 bath,Wifi , Gym , Pets allowed , Dishwasher
3, Cozy Private Bedroom Just a Block Away From Beach!, North Admiral,37,2  , 1  , 1  , 1 bath,Wifi , Self check-in , Beachfront,None
4, Spacious Sophisticated Space Needle  Home, Lower Queen Anne,84,3  , 1  , 1  , 1 bath,Wifi , Elevator , Self check-in , Dishwasher
5,  Comfy GREY room near Airport Downtown LightRail , Columbia City,33,2  , 1  , 1  , 1 shared bath,Wifi , Self check-in , Air conditioning , Dryer
6, City Garden Retreat in Vibrant Walkable Neighborhood, Wallingford,79,3  , Studio , 2  , 1 bath,Wifi , Dryer , Washer , Kitchen
7, Cool Greenlake studio loft guest house, Phinney Ridge,61,2  , Studio , 1  , 1 private bath,Wifi , Dishwasher , Kitchen,None
8, A place of your own   1BR in Seattle, Yesler Terrace,106,3  , 1  , 1  , 1 bath,Wifi , Gym , Air conditioning , Pets allowed
9, Charming & Bright Downtown Studio, Belltown,48,4  , Studio , 2  , 1 bath,Wifi , Self check-in , Washer , Kitchen
10, Live   Work   Stay   Easy   1BR in Mercer Island, Mercer Island,107,3  , 1  , 1  , 1 bath,Wifi , Gym , Pets allowed , Dishwasher
11, Live   Work   Stay   Easy   1BR in Seattle, Belltown,116,3  , 1  , 1  , 1 bath,Wifi , Gym , Air conditioning , Pets allowed
12, All inclusive apartment home   Studio in Seattle, Seattle,92,1  , Studio , 1  , 1 bath,Wifi , Gym , Pets allowed , Dryer
13, Beautiful Modern University District Studio, University District,64,2  , Studio , 1  , 1 bath,Wifi , Air conditioning , Dishwasher , Dryer
14, Live   Work   Stay   Easy   Studio in Seattle, Belltown,97,1  , Studio , 1  , 1 bath,Wifi , Gym , Air conditioning , Pets allowed
15, Rest easy and live life   Studio in Seattle, Yesler Terrace,93,1  , Studio , 1  , 1 bath,Wifi , Gym , Air conditioning , Pets allowed
16, The Sophie, Yesler Terrace,44,3  , Studio , 2  , 1 bath,Wifi , Self check-in , Dryer , Washer
17, Perfect location  spacious  walk to everything!, Capitol Hill,79,1,1,1,1,Wifi , Breakfast , Air conditioning , Pets allowed
18, Seattle Tech Amazon   Travelling nurse downtown UW, Eastlake,73,2  , 1  , 0  , 1 bath,Wifi , Self check-in , Pets allowed , Indoor fireplace
19, A place to call home   1BR in Seattle, Central Business District,148,3  , 1  , 1  , 1 bath,Wifi , Elevator , Pool , Gym
0, Super spacious modern townhome close to downtown, Haller Lake,75,8  , 3  , 4  , 2.5 baths,Wifi , Kitchen , Pets allowed , Indoor fireplace
1, Live   Work   Stay   Easy   1BR in Seattle, Belltown,119,3  , 1  , 1  , 1 bath,Wifi , Air conditioning , Kitchen , Pets allowed
2, Live   Work   Stay   Easy   1BR in Seattle, Belltown,116,3  , 1  , 1  , 1 bath,Wifi , Air conditioning , Kitchen , Pets allowed
3, All inclusive apartment home   Studio in Seattle, Seattle,92,1  , Studio , 1  , 1 bath,Wifi , Kitchen , Pets allowed , Gym
4, Live   Work   Stay   Easy   Studio in Seattle, Belltown,92,1  , Studio , 1  , 1 bath,Wifi , Air conditioning , Kitchen , Pets allowed
5, Live   Work   Stay   Easy   2BR in Seattle, Belltown,136,5  , 2  , 2  , 1 bath,Wifi , Air conditioning , Kitchen , Free parking
6, Cozy Private Bedroom Just a Block Away From Beach!, North Admiral,37,2  , 1  , 1  , 1 bath,Wifi , Self check-in , Beachfront,None
7, Hotel like 2BR 2BA near Seattle Waterfront, Central Business District,242,5  , 2  , 2  , 2 baths,Wifi , Air conditioning , Pool , Kitchen
8, Modern Capitol Hill Studio Steps to Volunteer Park, Capitol Hill,80,2  , Studio , 1  , 1 bath,Wifi , Kitchen , Pets allowed , Elevator
9, Detached Wallingford Studio Apartment, Fremont,55,2  , 1  , 1  , 1 bath,Wifi , Self check-in,None,None
10, Modern Studio in the Heart of the City Ii, Belltown,105,3  , Studio , 3  , 1 bath,Wifi , Air conditioning , Kitchen , Free parking
